id,requirement,clean
IOT_86,"If telemetry data is collected from consumer IoT products, such as usage and measurement data, it
should be examined for security anomalies.","telemetry datum collect consumer iot product usage measurement datum 
 examine security anomaly"
IOT_87,"Deleting personal data ""easily"" means that minimal steps are required to complete that action that each involve minimal
complexity.","delete personal datum easily mean minimal step require complete action involve minimal 
 complexity"
IOT_88,"Users shall be provided with functionality such that all their user data can be erased from the
consumer IoT device in a simple manner.","user shall provide functionality user datum erase 
 consumer iot device simple manner"
IOT_89,"The consumer should be provided with functionality on the consumer IoT device such that personal
data can be deleted from associated services in a simple manner.","consumer provide functionality consumer iot device personal 
 datum delete associated service simple manner"
IOT_90,"Users should be given clear instructions on how to delete and where possible to erase their personal
data from the device and associated services.","user give clear instruction delete possible erase personal 
 datum device associate service"
IOT_91,"Users should be provided with clear confirmation that personal data has been deleted and where
possible erased from devices and associated services.","user provide clear confirmation personal datum delete 
 possible erase device associated service"
IOT_92,"Installation and maintenance of consumer IoT should involve minimal decisions by the user and
should follow security best practice on usability.","installation maintenance consumer iot involve minimal decision user 
 follow security good practice usability"
IOT_93,"The manufacturer should provide users with guidance on how to securely set up their consumer IoT
device.","manufacturer provide user guidance securely set consumer iot 
 device"
IOT_94,"The manufacturer should provide users with guidance on how to check whether their consumer IoT
device is securely set up and maintained in a secure state.","manufacturer provide user guidance check consumer iot 
 device securely set maintain secure state"
IOT_95,"A Data input at application layer to the device via user interfaces shall be validated by the device
regarding unexpected data input to prevent system manipulations and failures.","data input application layer device user interface shall validate device 
 unexpected datum input prevent system manipulation failure"
IOT_96,"B Data input at application layer to the device via network interfaces shall be validated by the device
regarding unexpected data input to prevent system manipulations and failures.","b data input application layer device network interface shall validate device 
 unexpected datum input prevent system manipulation failure"
IOT_97,"Provision 6-1 The manufacturer shall provide consumers with clear and transparent information about what personal
data is processed and for what purposes, by whom, and for how long, for each consumer IoT device and associated
service.","provision 6 1 manufacturer shall provide consumer clear transparent information personal 
 datum process purpose long consumer iot device associate 
 service"
IOT_98,"Provision 6-2 Where personal data will be processed on the basis of consumers' consent, the consumer IoT device shall
provide a means to acquire this consent in a valid way.","provision 6 2 personal datum process basis consumer consent consumer iot device shall 
 provide means acquire consent valid way"
IOT_99,"Provision 6-3A Where personal data will be processed on the basis of consumers' consent, the consumer IoT device
shall provide a means to withdraw this consent at any time.","provision 6 3a personal datum process basis consumer consent consumer iot device 
 shall provide means withdraw consent time"
IOT_100,"Provision 6-3B Where personal data will be processed on the basis of consumers' consent, the consumer IoT device
shall provide a means of storing information about this consent.","provision 6 3b personal datum process basis consumer consent consumer iot device 
 shall provide means store information consent"
IOT_101,"Provision 6-4 If telemetry data is collected from consumer IoT products, the processing of personal data should be
limited to that which is necessary for the intended functionality identified in provision 6-5.","provision 6 4 telemetry datum collect consumer iot product processing personal datum 
 limit necessary intend functionality identify provision 6 5"
IOT_102,"Provision 6-5 If telemetry data is collected from consumer IoT products, consumers shall be provided with information
on what telemetry data is collected, how it is being used, by whom, and for what purposes.","provision 6 5 telemetry datum collect consumer iot product consumer shall provide information 
 telemetry datum collect purpose"
IOT_103,"Provision 6-6 Data stored and processed on a consumer IoT device, or made available to an associated service by the
consumer IoT device, for purposes identified in provision 6-1 shall be limited to that which is necessary for the purpose
for which it is being collected or processed, and deleted once no longer necessary for any of the purposes identified.","provision 6 6 datum store process consumer iot device available associated service 
 consumer iot device purpose identify provision 6 1 shall limit necessary purpose 
 collect process delete long necessary purpose identify"
IOT_104,"Provision 6-7 When the purpose of data collection from consumer IoT devices, or processing on the consumer IoT
device, is solely to compute an aggregate result, the data collected should be the minimum required to compute the
aggregate, the aggregation should happen as early as possible, and the retention of both collected data and the resulting
aggregate should be minimized.","provision 6 7 purpose datum collection consumer iot device process consumer iot 
 device solely compute aggregate result datum collect minimum require compute 
 aggregate aggregation happen early possible retention collect datum result 
 aggregate minimize"
IOT_105,"Provision 6-8 Data anonymization technologies should be used to protect privacy during data collection, processing
and storage.","provision 6 8 datum anonymization technology protect privacy data collection processing 
 storage"
IOT_106,"The existence of the feature,
capability or mechanism is not determined to be mandatory/recommended by the provision.","existence feature 
 capability mechanism determined mandatory recommend provision"
