id,requirement,clean
IOT_1,"The content of any electronic and/or
print versions of the present document shall not be modified without the prior written authorization of ETSI.","content electronic and/or 
 print version present document shall modify prior write authorization etsi"
IOT_2,"Users should be aware that the present document may be revised or have its status changed,
this information is available in the Milestones listing.","user aware present document revise status change 
 information available milestone list"
IOT_3,No recommendation as to products and services or vendors is made or should be implied.,recommendation product service vendor imply
IOT_4,In no event shall ETSI be held liable for loss of profits or any other incidental or consequential damages.,event shall etsi hold liable loss profit incidental consequential damage
IOT_5,"Any software contained in this deliverable is provided ""AS IS"" with no warranties, express or implied, including but not
limited to, the warranties of merchantability, fitness for a particular purpose and non-infringement of intellectual property
rights and ETSI shall not be held liable in any event for any damages whatsoever (including, without limitation, damages
for loss of profits, business interruption, loss of information, or any other pecuniary loss) arising out of or related to the use
of or inability to use the software.","software contain deliverable provide warranty express imply include 
 limit warranty merchantability fitness particular purpose non infringement intellectual property 
 right etsi shall hold liable event damage whatsoever include limitation damage 
 loss profit business interruption loss information pecuniary loss arise relate use 
 inability use software"
IOT_6,The content of the PDF version shall not be modified without the written authorization of ETSI.,content pdf version shall modify write authorization etsi
IOT_7,"National transposition dates
Date of adoption of this EN: 11 September 2024
Date of latest announcement of this EN (doa): 31 December 2024
Date of latest publication of new National Standard
or endorsement of this EN (dop/e): 30 June 2025
Date of withdrawal of any conflicting National Standard (dow): 30 June 2025
Modal verbs terminology
In the present document ""shall"", ""shall not"", ""should"", ""should not"", ""may"", ""need not"", ""will"", ""will not"", ""can"" and
""cannot"" are to be interpreted as described in clause 3.","national transposition date 
 date adoption en 11 september 2024 
 date late announcement en doa 31 december 2024 
 date late publication new national standard 
 endorsement en dop e 30 june 2025 
 date withdrawal conflict national standard dow 30 june 2025 
 modal verb terminology 
 present document shall shall need 
 interpret describe clause 3"
IOT_8,"must"" and ""must not"" are NOT allowed in ETSI deliverables except when used in direct citation.",allow etsi deliverable direct citation
IOT_9,"Terms
For the purposes of the present document, the following terms apply:
administrator: user who has the highest-privilege level possible for a user of the device, which can mean they are able
to change any configuration related to the intended functionality
associated services: digital services that, together with the device, are part of the overall consumer IoT product and that
are typically required to provide the product's intended functionality
EXAMPLE 1: Associated services can include mobile applications, cloud computing/storage and third party
Application Programming Interfaces (APIs).","term 
 purpose present document following term apply 
 administrator user high privilege level possible user device mean able 
 change configuration relate intended functionality 
 associate service digital service device overall consumer iot product 
 typically require provide product intend functionality 
 example 1 associate service include mobile application cloud computing storage party 
 application programming interface apis"
IOT_10,"In all cases, security, data protection and privacy by design and by default
should be used to inform the product development process, following risk assessment, but that is out of scope of the
present document.","case security datum protection privacy design default 
 inform product development process follow risk assessment scope 
 present document"
IOT_11,"The present document provides a
degree of flexibility through the use of non-mandatory ""should"" provisions (recommendations).","present document provide 
 degree flexibility use non mandatory provision recommendation"
IOT_12,"Testing and certification involving third party assessment is likely to require documentation, including architectural
design documentation, security requirements capture and analysis, threat models and environmental assumptions, policy
documentation for lifecycle management (including supply chain management), assessment certificates for any
components that are used to implement functionality required in the present document.","testing certification involve party assessment likely require documentation include architectural 
 design documentation security requirement capture analysis threat model environmental assumption policy 
 documentation lifecycle management include supply chain management assessment certificate 
 component implement functionality require present document"
IOT_13,"A justification shall be recorded for each recommendation in the present document that is considered to
be not applicable for or not fulfilled by the consumer IoT device.","justification shall record recommendation present document consider 
 applicable fulfil consumer iot device"
IOT_14,"It is recommended that the manufacturer conducts a threat modelling to identify, analyse and mitigate threats to the
device.","recommend manufacturer conduct threat modelling identify analyse mitigate threat 
 device"
IOT_15,"EXAMPLE 3: The consumer IoT device and associated service processes payments and is therefore required to
comply with the payment card industry specifications and for transaction processing and industry
and regulatory requirements for fraud monitoring.","example 3 consumer iot device associate service process payment require 
 comply payment card industry specification transaction processing industry 
 regulatory requirement fraud monitoring"
IOT_16,"Where passwords are used to authenticate users against the device or for machine-to-machine
authentication, and in any state other than the factory default, all consumer IoT device passwords shall be unique per
device or defined by the user.","password authenticate user device machine machine 
 authentication state factory default consumer iot device password shall unique 
 device define user"
IOT_17,"Where pre-installed unique per device passwords are used to authenticate users against the device or
for machine-to-machine authentication, these shall be generated with a mechanism that reduces the risk of automated
attacks against a class or type of consumer IoT device.","pre installed unique device password authenticate user device 
 machine machine authentication shall generate mechanism reduce risk automate 
 attack class type consumer iot device"
IOT_18,A Passwords should not be used for machine-to-machine authentication.,password machine machine authentication
IOT_19,"Authentication mechanisms used to authenticate users against the consumer IoT device or used for
machine-to-machine authentication shall use best practice cryptography, appropriate to the properties of the technology,
operating environment, risk and usage.","authentication mechanism authenticate user consumer iot device 
 machine machine authentication shall use good practice cryptography appropriate property technology 
 operating environment risk usage"
IOT_20,"Where a user can authenticate against a consumer IoT device, the consumer IoT device shall provide to
the user or an administrator a simple mechanism to change the authentication value used.","user authenticate consumer iot device consumer iot device shall provide 
 user administrator simple mechanism change authentication value"
IOT_21,"The consumer IoT device shall have a mechanism available which makes successful brute-force attacks
on authentication mechanisms via network interfaces impracticable unless the device has a resource constraint
determined by the use case that prevents the implementation.","consumer iot device shall mechanism available make successful brute force attack 
 authentication mechanism network interface impracticable device resource constraint 
 determine use case prevent implementation"
IOT_22,The manufacturer shall make a vulnerability disclosure policy publicly available.,manufacturer shall vulnerability disclosure policy publicly available
IOT_23,"This policy shall
include, at a minimum:
• contact information for the reporting of issues; and
• timelines for initial acknowledgement of receipt of a vulnerability report; and
• timelines for when the person who reported the issue will receive status updates until the resolution of the
reported issues.","policy shall 
 include minimum 
 contact information reporting issue 
 timeline initial acknowledgement receipt vulnerability report 
 timeline person report issue receive status update resolution 
 report issue"
IOT_24,Disclosed vulnerabilities should be acted on in a timely manner.,disclose vulnerability act timely manner
IOT_25,"Manufacturers should continually monitor for, identify and rectify security vulnerabilities within
consumer IoT products they sell, produce, have produced and associated services they operate during the defined
support period.","manufacturer continually monitor identify rectify security vulnerability 
 consumer iot product sell produce produce associate service operate define 
 support period"
IOT_26,"All software components in consumer IoT devices that are not immutable due to security reasons
should be securely updateable.","software component consumer iot device immutable security reason 
 securely updateable"
IOT_27,"The consumer IoT device shall have a secure update mechanism unless the device has a resource
constraint determined by the use case that prevents the implementation.","consumer iot device shall secure update mechanism device resource 
 constraint determine use case prevent implementation"
IOT_28,An update shall be simple for the user to apply.,update shall simple user apply
IOT_29,A One secure update mechanism should be configurable to be automated.,secure update mechanism configurable automate
IOT_30,"B During initialization the consumer IoT device should activate an automatic secure update mechanism
after user's consent.","b initialization consumer iot device activate automatic secure update mechanism 
 user consent"
IOT_31,"The consumer IoT device or an associated service should check after initialization whether security
updates are available.","consumer iot device associated service check initialization security 
 update available"
IOT_32,"A If the consumer IoT device supports automated updates, the user should be able to enable and disable
the automatic update mechanism and postpone the installation of updates provided via an automatic update mechanism.","consumer iot device support automate update user able enable disable 
 automatic update mechanism postpone installation update provide automatic update mechanism"
IOT_33,"B If the consumer IoT device supports update notifications, the user should be able to enable and
disable the update notifications.","b consumer iot device support update notification user able enable 
 disable update notification"
IOT_34,The consumer IoT device shall use best practice cryptography to facilitate secure update mechanisms.,consumer iot device shall use good practice cryptography facilitate secure update mechanism
IOT_35,Security updates shall be timely.,security update shall timely
IOT_36,The consumer IoT device should verify the authenticity and integrity of software updates.,consumer iot device verify authenticity integrity software update
IOT_37,"Where updates are delivered over a network interface, the consumer IoT device shall verify the
authenticity and integrity of each update via a trust relationship.","update deliver network interface consumer iot device shall verify 
 authenticity integrity update trust relationship"
IOT_38,"The user should be informed in a recognizable and apparent manner that a security update is required
together with information on the risks mitigated by that update.","user inform recognizable apparent manner security update require 
 information risk mitigate update"
IOT_39,"EXAMPLE 11: The manufacturer informs the user that an update is required via a notification on a user interface
or via an email.","example 11 manufacturer inform user update require notification user interface 
 email"
IOT_40,"The user should be notified when the application of a software update will disrupt the basic
functioning of the consumer IoT device.","user notify application software update disrupt basic 
 functioning consumer iot device"
IOT_41,"The manufacturer shall publish, in an accessible way that is clear and transparent to the user, the
defined support period.","manufacturer shall publish accessible way clear transparent user 
 define support period"
IOT_42,"For consumer IoT devices that cannot have their software updated, the rationale for the absence of
software updates, the period and method of hardware replacement support should be published by the manufacturer in
an accessible way that is clear and transparent to the user.","consumer iot device software update rationale absence 
 software update period method hardware replacement support publish manufacturer 
 accessible way clear transparent user"
IOT_43,"A For devices that cannot have their software updated, the consumer IoT device should be isolable.",device software update consumer iot device isolable
IOT_44,"B For devices that cannot have their software updated, the consumer IoT device hardware should be
replaceable.","b device software update consumer iot device hardware 
 replaceable"
IOT_45,"The model designation of the consumer IoT device shall be clearly recognizable, either by labelling
on the consumer IoT device or via a user interface.","model designation consumer iot device shall clearly recognizable label 
 consumer iot device user interface"
IOT_46,"Knowledge of the specific designation of the consumer IoT device is often required to check the defined support period
of software updates or the availability of software updates.","knowledge specific designation consumer iot device require check define support period 
 software update availability software update"
IOT_47,"It is recommended that the IoT device is to be clearly recognizable by having both a
model designation and a unique privacy preserving per device identifier, either by labelling on the device or via a
physical and logical interface.","recommend iot device clearly recognizable have 
 model designation unique privacy preserve device identifi label device 
 physical logical interface"
IOT_48,Sensitive security parameters in persistent storage shall be stored securely by the consumer IoT device.,sensitive security parameter persistent storage shall store securely consumer iot device
IOT_49,"Where a hard-coded unique per device identity is used in a consumer IoT device for security purposes,
it shall be implemented in such a way that it resists tampering by means such as physical, electrical or software.","hard cod unique device identity consumer iot device security purpose 
 shall implement way resist tamper mean physical electrical software"
IOT_50,Hard-coded critical security parameters in consumer IoT device software source code shall not be used.,hard cod critical security parameter consumer iot device software source code shall
IOT_51,"Any critical security parameters used for integrity and authenticity checks of software updates and for
protection of communication with associated services in consumer IoT device software shall be unique per device and
shall be produced with a mechanism that reduces the risk of automated attacks against classes of consumer IoT devices.","critical security parameter integrity authenticity check software update 
 protection communication associate service consumer iot device software shall unique device 
 shall produce mechanism reduce risk automate attack class consumer iot device"
IOT_52,The consumer IoT device shall use best practice cryptography to communicate securely.,consumer iot device shall use good practice cryptography communicate securely
IOT_53,"The consumer IoT device should use reviewed or evaluated implementations to deliver network and
security functionalities, particularly in the field of cryptography.","consumer iot device use review evaluate implementation deliver network 
 security functionality particularly field cryptography"
IOT_54,Cryptographic algorithms and primitives should be replaceable.,cryptographic algorithm primitive replaceable
IOT_55,"For devices that cannot be updated, it is important that the intended lifetime of the device does not exceed the
recommended usage lifetime of cryptographic algorithms used by the device (including key sizes).","device update important intended lifetime device exceed 
 recommend usage lifetime cryptographic algorithm device include key size"
IOT_56,"Access to consumer IoT device functionality via a network interface in the initialized state should only
be possible after authentication on that interface.","access consumer iot device functionality network interface initialized state 
 possible authentication interface"
IOT_57,"Consumer IoT device functionality that allows security-relevant changes in configuration via a network
interface shall only be accessible after authentication.","consumer iot device functionality allow security relevant change configuration network 
 interface shall accessible authentication"
IOT_58,"The exception is for network service protocols that are relied
upon by the consumer IoT device and where the manufacturer cannot guarantee what configuration will be required for
the consumer IoT device to operate.","exception network service protocol rely 
 consumer iot device manufacturer guarantee configuration require 
 consumer iot device operate"
IOT_59,"Critical security parameters should be encrypted in transit, with such encryption appropriate to the
properties of the technology, risk and usage.","critical security parameter encrypt transit encryption appropriate 
 property technology risk usage"
IOT_60,"The consumer IoT device shall protect the confidentiality of critical security parameters that are
communicated via remotely accessible network interfaces.","consumer iot device shall protect confidentiality critical security parameter 
 communicate remotely accessible network interface"
IOT_61,"The manufacturer shall follow secure management processes for critical security parameters that relate
to the consumer IoT device and for the entire lifecycle of the critical security parameters.","manufacturer shall follow secure management process critical security parameter relate 
 consumer iot device entire lifecycle critical security parameter"
IOT_62,"All unused network interfaces and all unused logical interfaces that are accessible through a network
interface shall be disabled.","unused network interface unused logical interface accessible network 
 interface shall disable"
IOT_63,"These interfaces may have been used only during the development phase of the device and are no longer required for
normal operation, or may be specific to certain environments or purposes.","interface development phase device long require 
 normal operation specific certain environment purpose"
IOT_64,"However, users may have the ability to manually enable any disabled interface that is required for their specific usage.",user ability manually enable disabled interface require specific usage
IOT_65,"In the initialized state, the network interfaces of the consumer IoT device shall minimize the
unauthenticated disclosure of security-relevant information.","initialized state network interface consumer iot device shall minimize 
 unauthenticated disclosure security relevant information"
IOT_66,Consumer IoT device hardware should not unnecessarily expose physical interfaces to attack.,consumer iot device hardware unnecessarily expose physical interface attack
IOT_67,"A Debug interfaces shall be disabled or protected via a best practice authentication or access control
mechanism.","debug interface shall disable protect good practice authentication access control 
 mechanism"
IOT_68,"It
is to be impossible for the user of the consumer IoT device to enable any disabled debug interface that is not considered
to be required for the consumer IoT device's lifecycle.","
 impossible user consumer iot device enable disabled debug interface consider 
 require consumer iot device lifecycle"
IOT_69,"However, if the debug interface is intermittently required after
the consumer IoT device is being placed on the market, it would be enough if the interface is disabled in software by
default but can be enabled, when required.","debug interface intermittently require 
 consumer iot device place market interface disabled software 
 default enable require"
IOT_70,B Debug interfaces that are physical ports should be physically protected by the device.,b debug interface physical port physically protect device
IOT_71,"The manufacturer should only enable software services that are used or required for the intended use or
operation of the consumer IoT device.","manufacturer enable software service require intend use 
 operation consumer iot device"
IOT_72,"EXAMPLE 7: The manufacturer does not provision the consumer IoT device with any background processes,
kernel extensions, commands, programs or tools that are not required for the intended use.","example 7 manufacturer provision consumer iot device background process 
 kernel extension command program tool require intend use"
IOT_73,Code should be minimized to the functionality necessary for the consumer IoT device to operate.,code minimize functionality necessary consumer iot device operate
IOT_74,"Software should run with least necessary privileges, taking account of both security and functionality.",software run necessary privilege take account security functionality
IOT_75,The consumer IoT device should include a hardware-level access control mechanism for memory.,consumer iot device include hardware level access control mechanism memory
IOT_76,"The manufacturer should follow secure development processes for software deployed on the consumer
IoT device.","manufacturer follow secure development process software deploy consumer 
 iot device"
IOT_77,The consumer IoT device should verify its software using secure boot mechanisms.,consumer iot device verify software secure boot mechanism
IOT_78,"A hardware root of trust can be either backed by mechanisms used for secure storage of
credentials or other alternatives providing baseline levels of security assurance proportionate to the required level of
security for a given consumer IoT device.","hardware root trust back mechanism secure storage 
 credential alternative provide baseline level security assurance proportionate required level 
 security give consumer iot device"
IOT_79,"If an unauthorized change is detected to the software, the consumer IoT device should alert the user
and/or administrator to the issue and should not connect to wider networks than those necessary to perform the alerting
function.","unauthorized change detect software consumer iot device alert user 
 and/or administrator issue connect wide network necessary perform alerting 
 function"
IOT_80,"The confidentiality of personal data transiting between the consumer IoT device and associated
services should be protected with best practice cryptography, appropriate to the properties of the technology, operating
environment, risk and usage.","confidentiality personal datum transit consumer iot device associate 
 service protect good practice cryptography appropriate property technology operating 
 environment risk usage"
IOT_81,"The confidentiality of sensitive personal data communicated between the consumer IoT device and
associated services shall be protected with best practice cryptography, appropriate to the properties of the technology,
operating environment, risk and usage.","confidentiality sensitive personal datum communicate consumer iot device 
 associate service shall protect good practice cryptography appropriate property technology 
 operating environment risk usage"
IOT_82,"All external sensing capabilities of the consumer IoT device shall be documented in an accessible way
that is clear and transparent for the user.","external sense capability consumer iot device shall document accessible way 
 clear transparent user"
IOT_83,"Resilience should be built in to consumer IoT products, taking into account the possibility of outages of
data networks and power.","resilience build consumer iot product take account possibility outage 
 data network power"
IOT_84,"Consumer IoT devices should remain operating and locally functional in the case of a loss of network
access and should recover cleanly in the case of restoration of a loss of power.","consumer iot device remain operate locally functional case loss network 
 access recover cleanly case restoration loss power"
IOT_85,"The consumer IoT device should connect to networks in an expected, operational and stable state and
in an orderly fashion, taking the capability of the infrastructure into consideration.","consumer iot device connect network expect operational stable state 
 orderly fashion take capability infrastructure consideration"
